zodiac,question,card1,card2,card3,reading
Capricorn,Am I open to receiving wealth?,Three of Swords,Six of Swords,Judgement,Reading:  Past hurts (Three of Swords) around finances are moving away (Six of Swords).  You're entering a new phase (Judgement) where you can redefine your relationship with wealth.  Consider what beliefs are holding you back.
Gemini,What do I need to know about my current spending habits?,Four of Cups,Six of Cups,Eight of Wands,"Gemini, you're bored with your current situation and romanticizing past purchases. New opportunities are coming quickly, so avoid impulse buys.  Save your money for what truly excites you."
Leo,What lesson am I learning through financial challenges?,Nine of Swords,Four of Pentacles,King of Pentacles,"Reading:  Leo, your anxiety (Nine of Swords) around money stems from wanting to hold on too tightly (Four of Pentacles).  You're learning to become more resourceful and grounded (King of Pentacles).  Focus on long-term security, not quick fixes."
Scorpio,What spiritual message do the cards offer about wealth?,The World,The Moon,Four of Cups,"Reading:  Scorpio, you've achieved a lot, but hidden emotions cloud your vision regarding abundance (The World, The Moon).  You may be overlooking opportunities due to dissatisfaction (Four of Cups). Appreciate what you have and stay open to new possibilities."
Capricorn,What emotional patterns affect my money decisions?,Nine of Pentacles,Ace of Cups,Page of Wands,"Capricorn, your self-sufficiency (Nine of Pentacles) can lead to emotional spending for comfort (Ace of Cups).  New ideas excite you (Page of Wands), sometimes causing impulsive buys.  Think before you spend to avoid emotional traps."
Taurus,What is the spiritual meaning behind my financial state?,The Hanged Man,Page of Wands,Four of Swords,"Taurus, your finances require a shift in perspective (The Hanged Man). New, inspiring ideas are coming (Page of Wands), but you need rest before pursuing them (Four of Swords).  Take a break to reflect before taking action."
Pisces,Is money flowing into my life or being blocked?,Ace of Pentacles,Seven of Cups,The Empress,"Reading:  The Ace of Pentacles shows new financial opportunities are coming, Pisces.  The Seven of Cups suggests you might be distracted by too many choices. The Empress reminds you to trust your intuition and nurture your ideas.  Focus on one path to see real growth."
Gemini,Is a financial breakthrough coming my way?,Knight of Pentacles,Ace of Cups,Ten of Pentacles,"Gemini, the Knight of Pentacles and Ace of Cups suggest steady progress and new emotional fulfillment influencing your finances. The Ten of Pentacles points to long-term stability and abundance arriving.  Keep working diligently and stay open to opportunities."
Cancer,What abundance is trying to enter my life?,King of Swords,Seven of Swords,The Hanged Man,"Reading:  Cancer, intellectual clarity is coming your way, but you might encounter some trickery or hidden information first.  This requires a new perspective, so be open to pausing and reflecting. Take your time to analyze the situation before making any decisions."
Cancer,What abundance is trying to enter my life?,Nine of Cups,Four of Pentacles,The Emperor,"Reading:  Cancer, emotional fulfillment and material security are headed your way, but you might be holding on too tight to what you have.  The Emperor suggests establishing healthy boundaries to welcome this abundance.  Loosen your grip to let the good stuff in."
Sagittarius,What is blocking my financial growth?,Two of Pentacles,Five of Pentacles,The Chariot,"Reading:  You're juggling too many financial priorities (Two of Pentacles), leading to a feeling of scarcity (Five of Pentacles).  Take control and focus your energy on one main goal (The Chariot).  Prioritize and commit to one path forward."
Capricorn,Am I being too cautious or too impulsive with money?,King of Pentacles,Three of Pentacles,Four of Swords,"Capricorn, your cautious nature (King of Pentacles) is clashing with a desire for collaborative spending (Three of Pentacles).  Taking a moment to reflect (Four of Swords) will bring clarity.  Think before you act."
Capricorn,What role does money play in my life's purpose?,Wheel of Fortune,The Hierophant,Five of Pentacles,"Capricorn, the Wheel of Fortune suggests money's role in your life is ever-changing.  The Hierophant points towards using your resources for traditional, established structures or institutions.  The Five of Pentacles highlights a possible feeling of lack despite your efforts.  Consider aligning your financial goals with your core values for greater satisfaction."
Pisces,What does the universe want me to know about my finances?,Knight of Cups,Six of Cups,The Moon,"Reading:  Pisces, your finances may feel a bit uncertain right now, relying on past habits or emotional spending.  Don't let your feelings cloud your judgment; some things are hidden.  Get practical and clarify your budget."
Pisces,Is financial freedom achievable for me?,Six of Pentacles,The World,The Chariot,"Pisces, the Six of Pentacles shows balanced giving and receiving, while The World suggests ultimate fulfillment, and The Chariot confirms you're on the right path.  Financial freedom is within your reach. Manage your resources wisely and maintain your drive."
Virgo,Will a new source of income appear soon?,Ace of Cups,Four of Pentacles,Page of Pentacles,"Reading:  An exciting new opportunity is coming, Virgo, but you might be hesitant to embrace it.  This could involve learning new skills to manage your resources.  Focus on developing practical skills to maximize this potential income stream."
Leo,Should I take the investment opportunity?,Page of Pentacles,The Hermit,The Emperor,"Leo, the Page of Pentacles suggests this is a good time to learn about investing.  The Hermit and Emperor advise caution and control, do your research first.  Take your time and carefully analyze this opportunity."
Sagittarius,What do I need to know about my current spending habits?,Three of Wands,Ace of Swords,Six of Pentacles,"Reading:  You're looking ahead and planning for the future (Three of Wands), and it's time to make a clear, decisive budget (Ace of Swords).  You're generous but strive for more balance in giving and receiving (Six of Pentacles).  Review your spending and create a practical plan."
Libra,Am I making wise financial decisions?,The Moon,Ace of Wands,Nine of Wands,"Libra, The Moon suggests some financial uncertainty clouding your judgment.  The Ace of Wands shows potential for new opportunities, but the Nine of Wands indicates you're feeling guarded.  Think carefully before committing to anything new."
Virgo,What role does gratitude play in attracting wealth?,Six of Pentacles,Five of Pentacles,Eight of Pentacles,"Virgo, the cards suggest a shift from scarcity (Five of Pentacles) to abundance (Six of Pentacles) through focused effort (Eight of Pentacles).  Gratitude helps you recognize existing resources and opens you up to receiving more.  Appreciate what you have to attract further wealth."
Gemini,How can I improve my budgeting and planning?,Ten of Swords,King of Wands,Knight of Wands,"Reading:  The Ten of Swords suggests you're feeling overwhelmed, but it's time to let go of past financial anxieties.  The King and Knight of Wands encourage you to take charge and be proactive with your finances.  Start small, stay organized, and be consistent."
Leo,Is a financial breakthrough coming my way?,The Magician,Eight of Wands,Ten of Swords,"Reading:  Leo, you have the tools and energy for a shift, but something is holding you back.  Quick progress is possible, but expect some painful changes.  Focus on removing obstacles to invite abundance."
Gemini,What mindset shift do I need for prosperity?,Justice,Knight of Wands,Knight of Pentacles,"Reading:  Gemini, Justice reveals a need for balanced decision-making. The Knight of Wands encourages embracing calculated risks, while the Knight of Pentacles suggests a grounded, patient approach.  Focus on combining action with careful planning for a prosperous future."
Taurus,How can I overcome fear around money?,Page of Cups,Six of Swords,The Empress,"Taurus, the Page of Cups suggests exploring your feelings about money creatively. The Six of Swords points to moving past old beliefs that no longer serve you.  The Empress encourages embracing abundance.  Let go of the past to welcome prosperity."
Taurus,Am I being too cautious or too impulsive with money?,Ace of Wands,Ten of Wands,Knight of Pentacles,"Reading:  The Ace of Wands suggests you have great financial potential but the Ten of Wands shows you're feeling burdened.  The Knight of Pentacles confirms your cautious nature is helpful now.  Focus on steady progress, not rapid change."
Virgo,Will I find a stable source of income?,Seven of Cups,The Chariot,Eight of Pentacles,"Virgo, the Seven of Cups suggests many job options may tempt you. The Chariot and Eight of Pentacles show focus and hard work will bring stability.  Keep your eye on the prize and refine your skills."
Scorpio,What should I focus on to build long-term wealth?,Seven of Wands,Queen of Pentacles,Wheel of Fortune,"Scorpio, the Seven of Wands suggests defending your current resources.  The Queen of Pentacles advises practical planning and grounded investments. The Wheel of Fortune reminds you that long-term wealth building takes time and consistent effort.  Stay focused and patient."
Aquarius,What career move would bring financial freedom?,Queen of Wands,Page of Pentacles,The Magician,"Aquarius, your charisma (Queen of Wands) combined with practical skills (Page of Pentacles) gives you the power to create your own success (The Magician).  A career requiring creative leadership and financial savvy will bring you freedom. Explore entrepreneurship or a management role."
Virgo,How can I release financial stress and anxiety?,The Hierophant,Page of Cups,Wheel of Fortune,"Virgo, The Hierophant suggests seeking expert advice.  The Page of Cups encourages you to explore creative solutions.  The Wheel of Fortune reminds you that change is inevitable.  Embrace new approaches to finances."
Aquarius,What does my intuition say about a financial move?,Six of Wands,Queen of Wands,Three of Cups,"Reading:  Aquarius, your intuition says this financial move will bring you public recognition and boost your confidence (Six of Wands, Queen of Wands).  It will also be a cause for celebration and strengthen bonds with others (Three of Cups). Trust your gut; this is a good move."
Scorpio,Am I aligned with my financial goals?,Seven of Swords,Ace of Swords,Knight of Cups,"Reading:  The Seven of Swords suggests some trickiness around your finances, perhaps some avoidance or unseen obstacles.  The Ace of Swords and Knight of Cups show you have the intellectual clarity and emotional drive to cut through this. Reassess your strategy and be honest with yourself."
Aries,Am I open to receiving wealth?,Seven of Cups,Page of Wands,Two of Pentacles,"Reading:  Aries, the Seven of Cups suggests you have many options but struggle to focus. The Page of Wands and Two of Pentacles show potential for new financial opportunities, if you can learn to balance them.  Pick one path and manage your resources wisely."
Pisces,Am I open to receiving wealth?,Temperance,Knight of Wands,Five of Wands,"Reading:  Temperance suggests you're finding balance but holding back.  The Knight of Wands shows a desire for abundance, though Five of Wands reveals internal conflicts.  Work through these disagreements to invite wealth in."
Gemini,Am I using my financial resources wisely?,Judgement,King of Pentacles,Two of Swords,"Gemini, Judgement suggests you're assessing past financial choices. The King of Pentacles shows potential for material stability, but the Two of Swords reveals some indecision.  Think carefully before making big money moves."
Gemini,How can I heal my relationship with money?,The Sun,Justice,Six of Swords,Reading:  The Sun brings optimism and abundance; embrace new financial opportunities.  Justice reminds you to be fair in your spending and saving.  The Six of Swords indicates it's time to move past old financial anxieties.  Look forward to a brighter financial future.
Scorpio,What can I do to attract financial success?,Nine of Cups,The High Priestess,The Moon,"Reading:  Scorpio, the Nine of Cups suggests you already have much to be grateful for, amplifying abundance.  The High Priestess encourages trusting your intuition regarding finances. The Moon card reminds you to be wary of illusions or get-rich-quick schemes.  Stay grounded and listen to your inner voice."
Libra,How can I overcome fear around money?,Ten of Swords,The Sun,Three of Cups,"Reading:  The Ten of Swords suggests you're hitting rock bottom with money worries, but The Sun shows a bright future ahead. The Three of Cups indicates finding support and celebrating small wins.  Let go of past financial burdens and embrace community."
Sagittarius,How can I create a healthier money mindset?,Judgement,Page of Swords,Four of Wands,Reading:  Judgement shows it's time for an honest review of your spending habits.  The Page of Swords suggests researching new budgeting methods and financial tools.  The Four of Wands indicates building a stable foundation through saving and smart investments will bring you security.  Start small and build new habits consistently.
Taurus,What is the next step in my financial journey?,Page of Swords,Four of Cups,Two of Cups,"Reading:  Taurus, the Page of Swords suggests researching new income streams.  The Four of Cups shows you're overlooking existing opportunities. The Two of Cups hints at a beneficial partnership. Consider collaborating to boost your finances."
Aquarius,What mindset shift do I need for prosperity?,The Fool,Ten of Wands,The Hermit,"Reading:  Aquarius, embrace the Fool's carefree leap into new ventures.  The Ten of Wands suggests releasing burdens holding you back. The Hermit advises seeking solitude for clarity on your goals.  Lighten your load and go explore."
Sagittarius,How can I heal my relationship with money?,Knight of Cups,Knight of Pentacles,Ten of Pentacles,"Reading:  The Knight of Cups suggests approaching finances with more emotional intelligence. The Knight of Pentacles and Ten of Pentacles indicate slow, steady work will build long-term security.  Be patient and consistent with your financial goals."
Capricorn,How can I manifest more financial opportunities?,Five of Pentacles,Ace of Wands,Temperance,"Capricorn, the Five of Pentacles suggests you're feeling a lack, but the Ace of Wands offers new beginnings.  Temperance encourages finding balance between work and rest.  Focus on new projects and pace yourself."
Pisces,What is the next step in my financial journey?,Three of Swords,The High Priestess,Nine of Cups,"Reading:  Pisces, a past hurt (Three of Swords) related to finances needs addressing before moving forward.  Trust your intuition (The High Priestess) as you manifest abundance (Nine of Cups). Accept the lessons and invite emotional healing to prosper."
Pisces,How can I balance giving and receiving financially?,Nine of Swords,Ace of Wands,Four of Wands,"Reading:  Pisces, the Nine of Swords suggests anxiety around finances may block abundance.  The Ace of Wands and Four of Wands point to new opportunities and stability if you take action.  Focus on building a secure foundation to alleviate worries and attract prosperity."
Capricorn,What energy surrounds my financial future?,Judgement,Eight of Pentacles,Three of Swords,"Capricorn, Judgement suggests a period of reflection on past financial choices.  The Eight of Pentacles indicates continued hard work and potential growth. However, the Three of Swords warns of potential painful decisions or necessary cuts.  Review your spending habits and prepare for change."
Sagittarius,How can I create more abundance in my life?,Justice,The Emperor,Page of Wands,"Reading:  Sagittarius, Justice suggests a need for balance and fairness in your dealings. The Emperor points to taking control and structuring your resources. The Page of Wands sparks inspiration to explore new income streams.  Seek opportunities aligned with your values and organize your finances for growth."
Gemini,What role does gratitude play in attracting wealth?,Two of Cups,The Empress,Queen of Wands,"Gemini, the Two of Cups, Empress, and Queen of Wands suggest gratitude strengthens partnerships that create abundance.  Appreciating your resources and others' contributions allows for growth and empowers you to manifest wealth.  Be thankful for what you have to attract more."
Gemini,What is blocking my financial growth?,Ten of Cups,Ace of Cups,Two of Pentacles,"Gemini, your emotional fulfillment (Ten of Cups) is strong, and new emotional beginnings are near (Ace of Cups).  However, you're struggling to balance your resources (Two of Pentacles). Focus on practical budgeting and prioritize your financial goals."
Scorpio,What can I do to attract financial success?,Ace of Pentacles,The Magician,King of Cups,"Reading:  Scorpio, the Ace of Pentacles suggests a fresh start with money.  The Magician shows you have all the tools needed for success. The King of Cups points towards balancing emotions with smart decisions.  Be practical and grounded."
Capricorn,Am I being too cautious or too impulsive with money?,The High Priestess,Five of Cups,Three of Cups,"Reading:  Capricorn, your intuition (High Priestess) tells you to evaluate past financial disappointments (Five of Cups).  Celebrating small wins with friends can bring more abundance (Three of Cups).  Focus on balancing thoughtful spending with enjoying your resources."
Virgo,What can I do to attract financial success?,Eight of Swords,Knight of Wands,Three of Swords,"Virgo, the Eight of Swords suggests you're feeling limited by self-doubt.  The Knight of Wands encourages you to act bravely despite any heartache (Three of Swords).  Free yourself from perceived limitations and take bold steps towards your goals."
Pisces,What is the next step in my financial journey?,Knight of Pentacles,Wheel of Fortune,Queen of Pentacles,"Reading:  Pisces, the Knight of Pentacles suggests a steady, practical approach is key right now. The Wheel of Fortune indicates a shift in your finances, likely positive.  The Queen of Pentacles confirms your ability to manage this change resourcefully.  Stay grounded and trust your instincts."
Sagittarius,Should I save more or invest more right now?,Ten of Cups,Six of Cups,Eight of Wands,"Reading:  The Ten and Six of Cups suggest focusing on your emotional and financial security.  The Eight of Wands shows quick progress is possible if you act decisively.  Right now, building a stable base is more important than risky ventures. Save more."
Scorpio,What should I focus on to build long-term wealth?,Four of Swords,Three of Pentacles,Ace of Swords,"Reading:  Scorpio, the Four of Swords suggests you need rest and strategic planning before acting.  The Three of Pentacles points to collaboration and teamwork to build your wealth.  The Ace of Swords confirms that clear, decisive action is key after your planning phase. Take a break, plan wisely, then act decisively."
Gemini,How can I overcome fear around money?,Six of Pentacles,Judgement,The Lovers,"Gemini, the Six of Pentacles shows you can find balance in giving and receiving.  Judgement encourages you to reassess past financial choices without self-criticism. The Lovers suggest choosing a path that aligns with your values.  Consider mindful spending and saving."
Virgo,What energy surrounds my financial future?,The Star,Death,Four of Pentacles,"Reading:  Virgo, your finances are shifting.  You're letting go of old habits to embrace new opportunities.  This change may require some careful budgeting.  Be open to new income streams."
Cancer,Am I using my financial resources wisely?,The Fool,Eight of Wands,Nine of Swords,"Cancer, you're taking risks, and things are moving quickly, but you're worried about the outcome.  The fast pace might lead to some sleepless nights if you aren't careful.  Slow down and plan your next steps."
Aries,Is now a good time to change my job for better pay?,Four of Wands,The Empress,Nine of Cups,"The Four of Wands suggests stability in your current role, while The Empress and Nine of Cups indicate contentment and abundance could be found elsewhere.  A change might bring the fulfillment you seek, but don't rush the decision. Consider what truly makes you happy."
Virgo,How can I balance giving and receiving financially?,Two of Swords,Ace of Wands,Knight of Swords,"Reading:  The Two of Swords suggests you're stuck making a financial decision. The Ace of Wands and Knight of Swords urge you to be bold and decisive, but strategic, about new income opportunities.  Think practically and act confidently to find your balance."
Scorpio,What energy surrounds my financial future?,Four of Wands,Ten of Swords,Page of Cups,"Reading:  Your finances will soon stabilize, offering a sense of security (Four of Wands).  A difficult period may end abruptly, creating space for new opportunities (Ten of Swords).  Be open to creative solutions and embrace your intuition regarding investments (Page of Cups).  Stay optimistic and explore fresh perspectives."
Cancer,What lesson am I learning through financial challenges?,Ten of Cups,The Chariot,King of Pentacles,"Cancer, the Ten of Cups, Chariot, and King of Pentacles suggest you're learning about balancing emotional needs with practical ambition. You're gaining control and learning resourcefulness despite instability.  Focus on building long-term security, not quick fixes."
Aries,Will my financial situation improve soon?,Four of Swords,Five of Pentacles,Seven of Pentacles,"Reading:  The Four of Swords suggests you need a break from stressing about money.  The Five and Seven of Pentacles indicate slow but steady growth, not a windfall.  Focus on long-term planning, not quick fixes."
Cancer,Is financial freedom achievable for me?,The High Priestess,King of Swords,The Star,"Cancer, your intuition (High Priestess) combined with smart decisions (King of Swords) points towards a bright financial future (The Star).  You have the potential to achieve your financial goals. Trust your gut and make clear-headed choices."
Aquarius,What mindset shift do I need for prosperity?,The Empress,Eight of Pentacles,Queen of Cups,"Reading:  Aquarius, embrace nurturing (Empress) and consistent effort (Eight of Pentacles) while trusting your intuition (Queen of Cups). This builds a foundation for the prosperity you seek.  Focus on practical action guided by your inner wisdom."
Taurus,How can I balance giving and receiving financially?,Five of Cups,The Fool,Eight of Swords,"Taurus, the Five of Cups shows past financial disappointments holding you back.  The Fool and Eight of Swords suggest you're mentally stuck, but ready to leap into new ways of managing money.  Release old patterns, and embrace a fresh start to find financial balance."
Capricorn,Will my financial situation improve soon?,Seven of Cups,King of Cups,The Hermit,"Capricorn, the Seven of Cups suggests many tempting options, but the King of Cups encourages emotional balance with your spending.  The Hermit points towards a period of reflection and reevaluation before things turn around.  Focus on making a practical budget."
Leo,Is my financial struggle temporary or long-term?,Knight of Swords,King of Pentacles,Temperance,"Reading:  The Knight of Swords suggests quick changes are coming, while the King of Pentacles hints at future stability.  Temperance indicates a balancing period is needed. Find ways to be resourceful now so you can enjoy abundance later."
Scorpio,What does the universe want me to know about my finances?,Ace of Pentacles,The Devil,The World,"Reading:  Scorpio, a fresh financial start is possible (Ace of Pentacles), but watch out for impulsive spending or toxic financial ties (The Devil).  You're on the verge of a complete financial cycle, bringing new opportunities (The World).  Think long-term and avoid quick fixes."
Leo,How can I heal my relationship with money?,The Empress,Knight of Swords,The Chariot,"Reading:  The Empress suggests nurturing your resources and valuing what you have.  The Knight of Swords encourages you to make clear, decisive financial choices.  The Chariot indicates you're ready to take control of your finances and move forward.  Be confident and strategic in your financial decisions."
Scorpio,What does my intuition say about a financial move?,Ten of Swords,Five of Cups,Knight of Cups,"Reading:  Your gut says this financial move will initially feel like a loss.  You're likely focusing on what you might be giving up.  However, a new, emotionally fulfilling opportunity is coming.  Trust your feelings, but look beyond the initial disappointment."
Libra,What should I focus on to build long-term wealth?,Nine of Swords,The Moon,Knight of Pentacles,"Libra, your anxieties (Nine of Swords) about finances are clouding your vision (The Moon).  Focus on slow, steady progress with practical investments (Knight of Pentacles).  Be patient and persistent for long-term gains."
Capricorn,What role does gratitude play in attracting wealth?,The Hanged Man,Page of Pentacles,The Star,"Capricorn, shifting your perspective (The Hanged Man) opens you to new learning (Page of Pentacles) that fosters hope and abundance (The Star). Gratitude helps you see these opportunities and builds a positive mindset for attracting wealth.  Appreciate what you have to invite more in."
Leo,Is money flowing into my life or being blocked?,Two of Pentacles,Knight of Pentacles,The Emperor,"Leo, you're juggling finances, but things are moving steadily, not blocked (Two of Pentacles, Knight of Pentacles).  You have the power to control and direct this flow toward stability (The Emperor). Take charge and budget wisely."
